report,unit
"Ganjil genap jakarta, perluasannya dan sistem transportasi umum

dear departemen perhubungan jakarta,

saya disini akan menyinggung tentang pemberlakuan ganjil genap yang diperluas.

1. perlu diperhatikan kenapa tidak diberlakukan untuk kendaraan bermotor roda dua? karena ini akan menambah jumlah kendaraan roda dua sedangkan pelanggaran yang terjadi di jakarta saja untuk kendaraan roda dua tidak bisa ditangani oleh aparat. banyak sekali yang tidak pakai helm, lawan arah, tidak ada surat lengkap. 

2. apakah transportasi umum sudah memadai, jumlah kendaraannya, ketepatan waktu datang, tempat menunggu dan rute menuju halte apakah sudah ramah lingkungan? jalan berdebu, trotar kecil, motor lawan arah, halte panas. belum lagi kendaraan datang tidak tepat waktu sehingga sewaktu masyarakat masuk kedalam, tidak rebutan tempat duduk. apakah sudah diperhatikan hal ini? buat laki2 memang mungkin tidak masalah, tadi ibu2, itu kasihan. apakah sudah aman dari copet atau prilaku asusila. saya rasa kalau kemendub menerapkan “mistery shopper” istilah dalam dunia retail yaitu team kemenhb setiap hari melakukan perjalanan di setiap moda transportasi umum dan melihat kejadian langsung, menilai kinerjanya apakah sudah layak, aman, dan bisa memanjakan masyarakat. ini harus dievaluasi. team dari kemenhun juga yang ke lapangan tidak perlu pakai baju kantor dengan atribut kepemerintahan. ini agar bisa terlihat real yang terjadi di lapangan seperti apa.
saya tinggal di jalan pemuda rawamangun dan kantor di pondok indah. saya pernah merasakan transportasi umum dalam kurun 3 bulan kebelakang, sangat mengecewakan baik itu transjakarta ataupun yang lain. berdesakan, tidak bisa duduk, debu, panas, dan waktu tempuhnya lebih lama dibanding saya membawa mobil. dan kepenatan yang saya rasakan dengan menggunakan transportasi umum justru lebih penat menggunakan transportasi umum daripada membawa kendaraan pribadi. apakah ini yang dinamakan transportasi umum andalan dan dapat memanjakan masyarakat? apakah ini sudah memadai?

3. kenapa pejabat daerah dengan sekumpulan “plat nomer sakti” itu bebas melewati rute ganjil genap, bukankan pegawai swasta, pelaku usaha dan yang lainnya ingin bekerja juga? bukankan kami masyarakat juga membayar pajak dan untuk negara termasuk pegawai dll? cobalah para pejabat tinggi, tiap hari ke kantor dengan kendaraan sendiri tanpa dikawal tanpa memakai “plat kendaraan dinas (hitam / merah) apakah sudah memilih jalan? jadi jangan diberlakukan untuk masyarakat tapi pejabat tinggi tidak merasakan masyarakat itu menjadi susah ke kantor atau tidak. apalagi ibu2 yang bekerja, tidak mungkin ibu2 pulang bekerja diatas jam 9 dengan alasan “ganjil genap” kasihan mereka terutama anak2 karena semakin sedikit waktu bertemu anak2. apakah ini tidak dipikirkan? ibu2 bekerja memang pilihan masing tapi ini harus diperhatikan.

3. pemberlakuan ganjil genap perluasan dengan ditambahnya tidak berlaku lagi persimpangan masuk tol dan keluar tol, ini sangat tidak masuk akal. jujur saya tidak nyaman dengan transportasi umum rute harian saya tapi kalau mau masuk tol dipersusah juga jadinya gimana kita mau kerja? para pejabar pemerintah mungkin enak dengan “plat nomer dinas” leluasa melewati semua jalan. dan bagimana dengan nasih masyarakat yanh tiggal di pinggir jalan ganjil genap dan hanya punya satu akses? ini namanya membatasi produktifitas masyarakat dong. persimpangan akses tol dan keluar tol harus bisa dilewati.
kami masyarakat meminta akses tol dan persimpangan keluar tol tetap ada dispensasi. jangan membatasi produktifitas kami. kami mau kerja pajak kami juga untuk negara. 

saya setuju ganjil genap tapi dengan evaluasi dan research yang benar, kalau dengan perluasan baru ini namanya membatasi geral dan produktifitas masyarakat jakarta. yang kaya / menengah atas akan beli mobil lagi dan tidak akan mengurangi kualitas udara. beli mobil listrik? peraturannya saja belum jelas, harga mobil listrik di negara asal tidak sampai miliaran dan masuk indonesia jadi 2-3 kali lipat  tidak ada solusi. ayah saya cuma punya satu mobil, dia seorang dokter sudah 60 tahun lebih masih bawa mobil sendiri, bukan dokter komersial yang uangnya banyak mobilnya banyak. saya sangat prihatin ayah saya harus cari jalan tikus untuk praktek ke rasuna dari rawamangun karena aturan ini. 

tolong aturan baru ini dievaluasi lagi.


cheers,
krishna raharja",Pemprov DKI 2
"Kepada Yth. Pemprov DKI Jakarta
Saya mengeluhkan buruknya kualitas keamanan Metromini 07 (Jurusan Semper - Senen) karena rawan akan copet. Sering sekali terjadi aksi copet di dalam Metromini tersebut. Biasanya pelaku naik dari Pasar Ular atau Pasar Kaget. Jumlah pelakunya bekisar 4-5 orang setiap hari dan sudah banyak orang yang telah menjadi korbannya.  Mohon pihak dishub bisa meningkatkan kualitas keamanan Metromini 07 tersebut dengan sering mengadakan razia di wilayah Pasar Ular dan berkoordinasi dengan pihak kepolisian untuk menangkap para pelaku copet tersebut guna meningkatkan keamanan dan kenyamanan para penumpang.  Demikian laporan saya. Mohon ditindaklanjuti pak, Terima Kasih ",Dinas Perhubungan
"@idolasemarang @Dishubkotasmg Pak, tolong setiap BRT di beri CCTV, karena banyak copet berkeliaran di BRT... #LaporHendi ",Dinas Perhubungan Kota Semarang
Tolong sampaikan kpd dishub jangan sampai melarang kendaraan online naek angkot itu lama suka ngetem berenti2 terus yg kerja dg kesiangan dtambah bnyak pengamen kadang ada copet.,Dinas Perhubungan Kota Bandung
"permisi, kemarin malam sekitar pukul 20.00 WIB saya mengalami pencopetan gadget Smartfren A16C3H di perjalanan kereta sepanjang perjalanan stasiun Manggarai - Kranji dan saya berhasil melacak gadget saya melalui layanan Find My Device dari Google pada sekitar pukul 9.30 WIB paginya dan posisi gadget saya masih berada di lokasi yang sama sampai saat ini (11.22 WIB) yakni di daerah Cilebut (untuk detail lokasi bisa dilihat di foto2 terlampir). 

Saya sudah mengunci perangkat saya dan menuliskan pesan untuk segera menghubungi no hp saya jika menemukan gadget saya tersebut barang kali hp saya hanya terjatuh bukan dicopet. namun ketika saya saya deringkan secara remoted, bukannya menghubungi saya, pemegang hp itu malah mematikan dering dan menonaktifkan gadget saya

Jadi saya harapkan dengan sangat untuk ditindak lanjuti, karna mungkin saja lokasi pada foto2 terlampir adalah markas dari pencopet stasiun atau semacamnya. terima kasih atas perhatiannya

catatan: hp saya seharusnya terpasang sim card smartfren dengan no. 088808196412

pelapor:
Raden Alwi Syahid Wahyudin
Perumahan Pulogebang Kirana Blok C7 No.22 Pulogebang Cakung Jakarta Timur
085710488086


",Kepolisian Negara Republik Indonesia
"Yth Menteri Bumn,Mohon ditingkatkan keamanan penumpang kereta krl jabodetabek .Sudah menjadi perbincangan umum bahwa copet sering berkeliaran saat penumpang padat dan berdesakan.Baiknya dipasang kamera di gerbong2 dan disosialisasikan serta dipakai untuk tangkap copet2..terimakasih.",PT Kereta Api Indonesia (Persero)
"mohon diperhatikan copet di kota Bandung beraksi di depan mata warga bandung seperti koboy jalanan tanpa ada rasa takut terhadap warga pada saat lampu merah di per4an asia afrika / jln. oto,...korban para penyebrang jln dr arah pasar baru...dlm aksinya 3 orang eksekutor 3 orang lg nunggu di motor siap untuk kabur.  Mohon segera di tangani kang Emil sy merasa risih sekali sebagai warga kota bdg,....nuhun",Kepolisian Negara Republik Indonesia
"mohon diperhatikan copet di kota Bandung beraksi di depan mata warga bandung seperti koboy jalanan tanpa ada rasa takut terhadap warga pada saat lampu merah di per4an asia afrika / jln. oto,...korban para penyebrang jln dr arah pasar baru...dlm aksinya 3 orang eksekutor 3 orang lg nunggu di motor siap untuk kabur.  Mohon segera di tangani kang Emil sy merasa risih sekali sebagai warga kota bdg,....nuhun",Satuan Polisi Pamong Praja Kota Bandung
"Saya pengusaha di bali. Saya memiliki toko di area legian-poppies lane 2.  2 tahun terakhir ini ekonomi di Bali sangat lesu. Awalnya saya pikir karena krisis ekonomi di eropa dan negara barat. Tetapi ada juga faktor internal. Seperti masalah sampah di pantai kuta yang banyak, membuat turis sudah tidak banyak lagi yang mau kesana.  Selain itu masalah yang lebih berat karena sudah banyak tukang copet, maling, rampok, bahkan perkelahian di area legian-poppies lane.  Saya sudah mengadu ke polisi setempat dan pemerintah kecamatan kuta. Mereka sudah tidak sanggup mengatasi banyaknya oknum kejahatan di kuta, terutama legian-poppies lane 2. Setelah diselidiki lebih lanjut, ada beberapa tokoh masyarakat sekitar yang tahu jika oknum copet itu baik dari ormas bali sampai ke pemerintah dan oknum polisi setempat ikut dapat jatah keuntungan dari hasil maling yang didapat.  Tolong bantu kami para pengusaha terutama yang punya toko di area legian-poppies lane. Mohon untuk segera ditertibkan agar omset tidak terus menurun yang awalnya omset mencapai 20 juta/hari menjadi tdak sampai 5 juta / hari.",Satuan Polisi Pamong Praja Kabupaten Badung
"Paspor saya hilang dari 2013 sewaktu ke thailand 2013 kemarin karena dicopet, sudah bikin paspor pengganti sementara untuk kembali ke indo pada waktu iu namun belum sempat mengurus paspor pengganti baru. Pertanyaannya sekaran untuk mendapatkan paspor baru apa yang harus saya lakukan? Bagaimana prosedurnya?",Direktorat Jenderal Imigrasi
"Banyak sekali copet... Baru aja kemarin pacar saya kecopetan di KRL selagi transit di stasiun duri . Penumpang juga berdesakan . Saya sarankan ada batasan penumpang kalau perlu pakai tiket gpp deh harga naik 2 atau 3 ribu atau bahkan 5 ribu.. asal penumpang nyaman.. gk berdiri lama.. apalagi berdesakan... Jadi malah gk aman... Saya bingung yg salah copet nya apa pacar saya yg kuran hati"" . Intinya tas nya udah di gendong di depan tetap saja karena berdesakan sang copet leluasa . Saya mohon di tanggapi.. agar tidak menjadi wacana saja.. terkadang penumpang lain tahu kalau org itu copet juga hanya diam.. mungkin nyari aman.. nyesek yah kecopetan hahahaha ",PT Kereta Api Indonesia (Persero)
Mohon ditingkatkan pengamanan di depan Kodim Pintu Kereta Jatinegara karena banyak copet dan jambret dan mulai beraksinya selepas Isya'. Mereka sudah terang-terangan dan bergerombol.,PT Kereta Api Indonesia (Persero)
"Berhubung semakin marak dan banyak terjadi penodongan, perampokan, pencopetan di Mall, penembakan dengan semena-mena, mohon dibantu agar ditingkatkan patroli keliling ke seluruh wilayah Kota Jakarta tanpa terkecuali.",Kepolisian Negara Republik Indonesia
"Kepada Yth. Pemprov DKI Jakarta. Saya pengguna bus TJ sejak 4 tahun yang lalu, saya mengikuti perkembangannya, selama menggunakan bus TJ saya pernah kecopetan hilang 2 mobile phone di dalam tas, karena sering naik bus TJ, maka saya pernah hafal wajah-wajah pencopet di dalam bus TJ. Pernah juga melihat ada seorang ibu jatuh ke tanah ketika berebutan naik bus TJ di halte Dukuh Atas 2 jurusan Pulo Gadung, ibu tersebut ketika melangkah akan masuk bus, didorong oleh desakan banyak calon penumpang, sehingga ibu tsb jatuh melalui celah antara bus dan anjungan halte. Pernah pula baru-baru ini melihat seorang ibu yang kakinya terperosok ke celah antara bus dan anjungan halte di Bunderan Senayan, hal itu terjadi juga dikarenakan dorongan desakan dari penumpang dari samping kiri kanan dan belakang. Kesimpulan dari cerita saya di atas bahwa, diperlukan petugas yang sigap tanggap tegas tetapi tetap ramah untuk menangani ketika ada kejadian misalnya jatuh, terperosok dll yang menyebabkan kerugian moril dan materi. Petugas yang dapat mengatur antrian penumpang yang akan naik bus TJ pada jurusan2 dan jam2 tertentu.yang padat. Petugas yang siap melayani bila ada yang sakit, disiapkan pula peralatan P3K di setiap halte (saya pernah melihat petugas yang kelihatan bingung harus berbuat apa ketika melihat seorang ibu yang kesakitan kakinya, hanya melakukan pencatatan kejadian saja). Petugas penjaga pintu bus TJ yang disiplin informatif, sering saya lihat ada petugas yang tidak menunjukkan papan jurusan yang biasa ditunjukkan kepada calon penumpang, sehingga calon penumpang bertanya dulu padahal kondisi antrian sudah padat. Saya juga mengusulkan kiranya adanya tersedia toilet, saya lihat ada toilet di area halte Dukuh Atas 2, tetapi toiletnya tidak layak pakai.  Mohon dinas terkait untuk menindaklanjutinya. Terima kasih.",Badan Layanan Umum Transjakarta
"Slmt pagi pak hendy, mohon Jalan Nogososro perumnas Tlogosari stelah ditinggikan dikasih lampu PJU, karena lampu yg tersedia adlh inisiatif dn iuran dr warga sendiri. Kami nilai msh sangat gelap dn banyak tindakan kriminalitas sprti copet dan begal, mohon dibantu utk diberikan PJU. Terimakasih",Dinas Perumahan dan Kawasan Permukiman Kota Semarang
"LAPOR HENDI Slmt pagi pak hendy, mohon Jalan Nogososro Perumnas Tlogosari stelah ditinggikan dikasih lampu PJU, karena lampu yg tersedia adlh inisiatif dn iuran dr warga sendiri. Kami nilai msh sangat gelap dn banyak tindakan kriminalitas sprti copet dan begal, mohon dibantu utk diberikan PJU. Terimakasih",Dinas Perumahan dan Kawasan Permukiman Kota Semarang
"Kepada Yth. Pemprov DKI Jakarta
 Prihal bus feeder senen lebak bulus pagi ini. Pagi ini saya merasakan sangat lamanya menunggu bus feeder ini, saya menunggu di halte bus deplu (pejambon), saya sampai halte jam 7.40 , jam 8.00 bus feeder datang sudah penuh dan hanya perbolehkan 1 penumpang saja yang naik, saya menunggu lagi, 15 menit kemudian tidak ada bus feeder yang lewat. Akhirnya saya memutuskan naik kopaja dengan resiko copet, penumpang di oper seenaknya dan ""ngetem"" semaunya, ya benar saja sampai di cikini saya di oper dan harus menunngu bisnya ""ngetem"" cari penumpang.  Saya lihat sudah seharusnya rute ini bisnya ditambah karena peminatnya banyak sekali, sehingga bisa minimal bis lewat per 2 atau 3 menit sekali. Sekarang semakin susah mendapat bis feeder yang tidak penuh sesak. Terima Kasih",Badan Layanan Umum Transjakarta
"Yth, BPJS Kesehatan KLOK Labuhanbatu Utara Saya PNS Daerah Labuhanbatu Utara kemarin saya kecopetan dan saya kehilangan kartu BPJS Kesehatan saya, bagaimana cara saya mendapatkan kartu kembali dan terima kasih",BPJS Kesehatan KC Tanjung Balai
"ibu, anak saya ini kemaren kecopetan, hilanglah dompetnya berserta isi2nya , didalamnya ada kartu bpjs anak saya. anak saya ini tanggungan saya, sy PNS bu. kayak mana ya bu mengurusnya lagi supaya kartu anak saya ini ada kembali, apa-apa saja syarat2nya?",BPJS Kesehatan KC Tanjung Balai
"Kepada, Yth. Pemerintah Provinsi DKI Jakarta,

Mohon ditindak Bus Mayasari Bakti 57 jurusan Pulogadung - Blok M yang jam ini beroperasi tetapi tidak terang lampunya di dalam yang menyebabkan rawan copet, rampok. Terima kasih.",Dinas Perhubungan
"Selamat siang, saya ingin menyampaikan keluhan pembuatan E-KTP di Kecamatan Medan Sunggal, Medan, Sumatera utara. Disini saya sedang mengurus kembali E-KTP saya karena E-KTP saya yang sebelumnya hilang kecopetan. Tetapi sesampainya di kantor kecamatan saya diberitahukan bahwa harus menunggu sampe tahun depan dikarenakan tidak ada blangko yang tersedia di kantor kecamatan tersebut. Sekian keluhan saya.",Kementerian Dalam Negeri
"Yth, BPJS Kesehatan Labuhanbatu Utara saya Pegawai Negeri Sipil dan kemarin saya kena copet tas dan di dalamnya ada Kartu BPJS Kesehatan saya, yang saya akan pertanyakan bagaimana cara untuk mendapatkan kartu BPJS Kesehatan saya ??",BPJS Kesehatan KC Tanjung Balai
"LAPOR HENDY Saya naik bus Taruna dari Solo-Semarang dan mengalami musibah, dompet serta HP dan seluruh surat-surat penting hilang. Kejadian pada hari Sabtu tanggal 3 Desember 2016 pukul 07.20 di Pintu Masuk Terminal Terboyo Semarang. Diperkirakan copet masuk bis di sekitar banyumanik. Tolong keamanan wilayah Semarang diperhatikan Pak, sudah banyak korban di Terminal Terboyo terbukti Semarang tidak aman khususnya bagi pengguna kendaraan umum. Terima kasih","Dinas Perhubungan, Komunikasi, dan Informatika Kota Semarang"
"kerap terjadi kasus pelecehan seksual dan pencopetan di gang bukit sastra jalan ciumbuleuit dekat kampus UNPAR, saat melapor ke RT dia malah mengatakan ""tidak apa2 asal korbannya bukan pribumi"". kami memohon dengan sangat untuk ditindak karena ini mengganggu kami, sudah banyak sekali korban ",Kecamatan Coblong Kota Bandung
"Istri saya eKTP nya sudah pernah dibuat, tetapi dulu sempat kecopetan dan diberikan KTP kertas biasa. Setelah lama, akhirnya kami memutuskan untuk meminta versi eKTP.

Kronologis :
Jumat, 9 September 2016
Sekitar pukul 11.30an kami mendatangi Kelurahan Jelambar Baru untuk meminta pencetakan ulang. Namun pegawainya menyarankan untuk datang setelah jam 1 saja untuk mengambil form pencetakan ulang (tanpa dianjurkan mengambil nomor pelayanan).

Kemudian sekitar pukul 13.00 kami datang kembali ke Kantor Kelurahan tersebut. Ternyata kami baru tahu bahwa harus mengambil nomor. Kami pun baru mengambil nomor, dan mendapatkan nomor antrian ke-66. Waktu itu sedang giliran nomor ke-30.
Jadi kami menunggu untuk dilayani dari sekitar pukul 13.00.

Pertanyaannya, jika memang warga Jelambar sangat banyak, mengapa hanya disediakan satu counter yang melayani KTP? Dan kami merasa dirugikan karena harus menunggu selama hampir 4 jam hanya untuk mencetak ulang eKTP, yang mana datanya seharusnya sudah ada. Kami dan sebagian orang lain mengalami hal yang sama. Mengapa pelayanan Kelurahan Jelambar Baru begitu lama dan membuang-buang waktu? Kami pun juga punya pekerjaan dan urusan lain yang harusnya dikerjakan.",Dinas Kependudukan dan Pencatatan Sipil
"Saya Waenah dari Indramayu, E-KTP saya kecopetan. Untuk print ulang e-ktp apakah tetap harus di Kecamatan Domisili atau bisa dilakukan di Jakarta?  Bagaimana prosesnya? ",Kementerian Dalam Negeri
"Ada yang saya ingin tanyakan khususnya tentang E-KTP, sebelumnya saya sudah membuat E-KTP, tetapi karena saya mendapatkan musibah kecopetan, sehingga E-KTP saya hilang tetapi sudah saya urus dan mendapat pengganti KTP biasa (2 tahun yang lalu). Yang saya ingin tanyakan, apakah sekarang sudah bisa saya urus kembali untuk mendapatkan E-KTP lagi? (mendengar berita agar segera mengurus E-KTP). Jika bisa, bagaimana prosedurnya? tetapi jika tidak bisa, apa alasannya? dan berapa lama saya harus menunggu sampai bisa memproses pergantian menjadi E-KTP? atau saya harus menunggu sampai masa aktif KTP habis (2018)? Saya membuat KTP di kelurahan Pulomerak Banten.",Kementerian Dalam Negeri
"Kepada,
Yth. Pemerintah Provinsi DKI Jakarta,

Mohon Pemprov DKI Jakarta memberikan kenyamanan untuk masyarakat menggunakan angkutan umu, sehingga program pemprov DKI Jakarta untuk angkutan massal berhasil. Dan mohon copet-copet untuk diberantas di angkutan umum sehingga masyarakat nyaman untuk menggunakan nagkutan umum. Terima kasih.",Dinas Perhubungan
"Pada tanggal 18 juni 2016 kemarin istri saya yang bernama NOVA LUKITAWATI menjadi korban pencopetan didaerah Pakah, Tuban, Jawa Timur. dan kemarin tanggal 19 juni ada sesorang yang meng Upload foto isi dari tas istri saya tersebut ke Facebook Media Informasi Tuban, dan orang tersebut menyuruh mengambil tas tersebut di daerah brondong, lamongan dan daerah tersebut rawan terhadap kejahatan kami yakin orang tersebutlah pelakunya dan mau menjebak kami. kami mohon bantuanya bapak-bapak POLRI Indonesia untuk menumpas penjambretan/kejahatan yang terjadi di daerah tuban dan sekitarnya agar tidak ada lagi korban berikutnya, berikut kami lampirkan hasil upload seseorang tersebut ke media informasi tuban dan obrolan seseorang tersebut dengan teman-temannya, semoga menjadi bahan untuk menangkap tersangka tersebut beserta komplotannya.
 Terima kasih atas bantuan dan kerjasamanya.

Salam,
 Nafi",Kepolisian Negara Republik Indonesia
"yth kepolisian bandung
saya mau melaporkan daerah tegalega,alun alun,perempatan buah batu,perempatan leuwih panjang banyak nya pengamen yang memaksa dengan nada nyanyian yang meresahkan seperti ""dari pada saya mencopet lebih baik mengamen"" kalo ga di kasih dia marah marah dan kalo di kasih sedikit dimarah marah lebih baik ga ada pengamen terutama yang pakai anting anting besar di telinga,pakaian yang kumel berlaga seperti preman sekarang banyak di bandung seperti itu mohon di tindak lanjuti hal hal seperti itu karena meresahkan sekitar apalagi pengguna angkutan umum",Dinas Sosial dan Penanggulangan Kemiskinan Kota Bandung
bagaimana cara mengurus kartu bpjs mandiri hilang kecopetan minggu yang lalu?,BPJS Kesehatan KCU Palembang
"PENGURUSAN E-KTP SUSAH SEKALI (KECAMATAN ILIR BARAT II PALEMBANG, SUMATRA SELATAN)

Saya ingin menyampaikan keluhan berkaitan dengan susahnya mengurus e-KTP d Kecamatan Ilir Barat II Kodya Palembang Provinsi Sumatra Selatan. Adik saya kehilangan e-KTPnya karena kecopetan, sudah membuat surat keterangan hilang dari kepolisian bahkan sudah isi data ulang difoto ulang hingga saat ini sudah setahun lebih e-KTP belum jadi dengan alasan tidak bisa cetak e-KTP, tidak konek ke Pusat Jakarta, alat rusak, dll.

Sayapun mempunyai masalah berkaitan dengan e-KTP saya. Tanda tangan yang tercetak hilang 90% ke belakang (ntah kenapa cetakannya sangat jelek) sehingga saya kesulitan mengurus apapun berkaitan dengan bank karena ttd saya berbeda jauh di buku tabungan. Ya masuk akal karena ibarat orang yang kelihatan kepala saja, leher sampai kakinya tidak ada. Saya sudah bertanya pada ibu saya apakah bisa dicetak ulang e-KTP saya karena kesulitan mengurus apapun terutama berkaitan dengan bank (kebetulan saya kerja di luar kota Palembang), namun apa daya masih dengan jawaban yang sama 2 tahun terakhir ini tidak ada perubahan.

Saya sangat jengkel jadinya dengan situasi ini. Yang buat saya jengkel mau sampai kapan hal ini dibiarkan oleh mereka? Jika memang alat rusak apakah tidak ada budget untuk diservis? Mau tunggu sampai kapan masalah ini selesai dan masyarakat dapat dilayani dengan baik kalau tidak ada penyelesaian dari mereka sendiri? Kapan permasalahan masyarakat mau selesai kalau hal sepele seperti e-KTP susahnya minta ampun dengan alasan yang konyol yang dipakai bertahun2 yang menunjukkan sebagai aparat mereka tidak peduli dengan kepentingan masyarakat.

Mohon dicek langsung ke Kecamatan ini. Saya benar2 kecewa dengan pelayanan mereka. Saran saya coba jadi menyamar menjadi orang yang mau membuat e-KTP ya semacam audit rahasia biar Pusat tahu bagaimana kinerja mereka. Coba tanya sudah berapa lama hal ini berlangsung. Survei dengan Ketua RT yang berada di bawah Kecamatan Iir Barat II  Palembang Sumatra Selatan supaya tahu bagaimana kinerja aparat kecamatan Ilir Barat II. Semoga ada tindak lanjut nyata dari pemerintah pusat atas hal ini.

Demikianlah permasalahan yang saya sampaikan. Makin maju negara Indonesia kita, milik bersama.",Kementerian Dalam Negeri
"Kepada Yth,
Kepala Disdukcapil Tangerang Kota
Di tempat


Saya ingin menanyakan mengenai status pencetakan KTP elektronik saya. Pada tanggal 19 Mei 2015 saya kecopetan dan kehilangan KTP dan kartu2 lainnya. Kemudian saya mengajukan untuk penggantian KTP dan diberikan kertas kecil untuk mengambil KTP elektronik 2 bulan kemudian. Lalu saya datang kembali untuk mengambil KTP pada bulan Juli, namun dikatakan KTP belum jadi karena blanko masih kosong, dan saya diminta datang kembali dalam waktu 1 bulan. Kemudian tanggal 11 Agustus saya datang kembali dan ternyata KTP saya belum jadi juga dan saya diberikan surat keterangan sebagai pengganti KTP. Di dalam surat keterangan dikatakan KTP saya dapat ditukar dengan surat keterangan pada bulan Januari 2016, dan status pencetakan dapat dilihat di website www.disdukcapil.tangerangkota.go.id/cekktpel

Namun sampai pagi ini, yaitu tanggal 3 Februari 2016, saya cek status KTP saya belum dicetak.


Tolong saya minta keseriusan pihak Disdukcapil dalam pelayanan terhadap masyarakat, karena saya tidak punya pegangan apapun sebagai bukt identitas saya. Saya pun merasa dirugikan karena saya bolak balik datang ke kecamatan selalu mendapat jawaban mengecewakan bahwa KTP saya belum jadi. Padahal saya harus ijin dari tempat saya berkerja untuk mengurus KTP dan itu membuang waktu saya. Selain itu pekerjaan saya juga menuntut saya untuk berpergian keluar kota minimal 3 kali dalam 1 bulan dan otomatis saya harus ke bandara dan di bandara seeringkali saya bermasalah karena tidak bisa menunjukkan KTP dan hanya surat keterangan yang makin lama juga semakin lusuh karena seringkali dikeluarkan untuk pengecekan di bandara maupun tempat2 lainnya.

Oh ya, selain itu ternyata KTP Kakak saya pun sejak pertama kali perekaman data sekitar tahun 2013 belum jadi sampai sekarang, namun kakak saya tidak mengurus lagi karena bosan berkali2 datang ke kecamatan selalu mendapat jawaban yang sama kalau KTP belum tercetak.

Terus terang kami sangat kecewa dan tidak nyaman dengan kondisi ini. Saya minta dengan sangat supaya KTP kami dan mungkin banyak sekali masyarakat yang merasakan kekecewaan yang sama seperti kami dapat segera tercetak.

NIK kami :
1. Elva Aprilia Nasution 3671135604820003
2. Mulia Sakti Nasution 3671136501810001

Terima kasih

Salam,
Elva Aprilia Nasution, S. Farm",Kementerian Dalam Negeri
