report,unit
"Hari ini saya membaca berita tentang bus baru dari Dephub untuk kota-kota di Indonesia. berikut kutipan:

""Penerima 1.050 unit bus BRT, yaitu Pemda Aceh (25 unit), Lampung (20 unit), Maluku (lima unit), Yogyakarta (25 unit), Kota Pekanbaru (50 unit), Kota Batam (15 unit), Kota Palembang (50 unit), Kota Semarang (25 unit), Kota Sorong (10 unit), Perum Damri (225 unit) dan Perum PPD (600 unit). ""

http://nasional.republika.co.id/berita/nasional/kemenhub/16/01/21/o1aj8r219-kemenhub-serahkan-1240-bus-ke-pemda-dan-bumn

1).
 Saudara saya setiap minggu pengguna bus Semarang - Solo dan melanjutkan perjalanan Solo-Jogja untuk bisa turun di Delanggu, Keadaan bus Solo Jogja kurang layak dan minim jumlahnya sehingga ketika weekend sesak penumpang dan rawan copet. Mohon bantuannya agar ada pengawasan dari Dephub sehingga ada pemerataan distribusi bus baru tersebut agar mencakup seluruh kota kecil dan memudahkan transportasi warga.

2) 
 Juga berharap ada kereta langsung dari Semarang menuju Jogja yang berhenti di stasiun Delanggu. Banyak sekali warga commuter yang weekend ke daerah klaten dan sekitarnya (namun bekerja di Semarang). Dengan adanya kereta sebenarnya bisa mengurangi kemacetan jalan solo semarang. Sekarang sudah ada kereta Semarang ke Solo tapi hanya 1 x sehari pagi. Dan ada kereta prameks Solo ke Jogja tiap 2 jam , tapi tidak berhenti di stasiun Delanggu. Hal ini menyulitkan kami sebagai warga Pak. Mohon perhatiannya.

Salam.",Direktorat Jenderal Perhubungan Darat
"Kartu BPJS saya hilang karena dompet saya hicopet orang, bisa tidak saya mendapatkan kartu BPJS yang baru ?",BPJS Kesehatan KC Prabumulih
"Apa betul di Bandung ada acara Musyawarah Copet se Jawa ? Kumaha kang Emil,  teu ngisinkeun urang Sunda ? ( harian kompas 7 jan.2016 ) Was. Yoga.",Dinas Komunikasi dan Informatika Kota Bandung
"Tablet ASUS hilang dikereta api. Tas robek bekas sayatan benda tajam. Keamanan Kereta Api buruk? Copet berkeliaran. Menteri Perhubungan, BUMN dan PT KAI kemana bisa membiarkan copet berkeliaran dalam kerata api?",PT Kereta Api Indonesia (Persero)
"Yth. Kementerian Ketenagakerjaan, Bagi karyawan yang masih bekerja proses pencairan pensiun sebesar 10 persen atau 30 persen, saya rasa tidak efisien dan rumit. Hal tersebut karena karyawan harus bolak-balik dengan antrian yang panjang. Selain itu, dari segi kemanan di luar gedung juga masih kurang karena terdapat banyak copet. Oleh karena itu, sebaiknya sistem pengambilan lebih dipermudah dengan kerjasama antara BPJS dan unit personalia perusahaan dimana karyawan bekerja, sehingga untuk pendaftaran dan pengisian formulir secara kolektif. Kemudian dananya ditransfer ke rekening bank masing-masing karyawan yang biasa digunakan transfer gaji. Mohon dipertimbangkan, terima kasih",Kementerian Ketenagakerjaan
"Yth. Kementerian Perhubungan

Saya sebagai pengguna transportasi angkutan kota berupa angkot biasa (Trayek Plaju Ampera) dan Bis Kota (bukan Trans Musi) ingin menyampaikan keluhan yang mungkin saja sudah menjadi hal yang lumrah dikalangan DISHUB sendiri.

1. Supir Ugal-ugalan, ada juga sopir dan kernet Mabuk Minuman Beralkohol.

2. Tidak memakai Sabuk Pengaman (sabuk keselamatan) dan sengaja mencopot/memutuskan sabuk/ menghilangkan sabuk dari tempatnya agar punya alasan tersendiri ketika terkena razia.

3. Supir yang selalu gonta-ganti / supir tembak, bahkan supir ada yang mengaku masih sekolah SMA dan jadi supir karena ingin uang rokok, berarti banyak supir yang tidak memiliki SIM dan surat kelengkapan untuk membawa kendaraan.

4. Banyak Angkot dan Bis Kota beroperasi dengan kondisi TIDAK LAYAK JALAN, terlihat jelas dari kondisi fisik kendaraan mulai dari speedometer tidak berfungsi, lampu sorot tidak berfungsi, lampu sein tidak berfungsi, dan kondisi body yang rapuh dan berkarat.

5. kelengkapan surat emisi kendaraan & surat layak jalan / KIR diragukan, karena banyak sekali angkot dan BIS KOTA yang bisa beroperasi dengan kondisi asap yang mengepul, kondisi Ban Gundul, dan kondisi-kondisi lainnnya seperti pada bagian nomor empat sebelumnya. apakah terjadi tindakan suap menyuap dibagian dinas terkait? Mohon DISIDAK.

6. Ada Sopir / kernet yang diduga bersengkongkol dengan para pencopet yang biasa beraksi di angkot & BUS. seharusnya bisa dicegah ternyata mereka dengan sengaja meloloskan mereka ketika lari dan seolah acuh tak acuh, keamanan penumpang tidak terjamin.

7. Pajak kendaraan Angkot & Bis Kota (ketika beroperasi di jalan) banyak yang MATI terutama pajak tahunan, TNKB / NOPOL kendaraan yang sudah mati, bahkan tanggal ""masa uji berlaku kendaraan"" juga banyak yang sudah lewat bahkan ada yang sengaja dihapus atau dibuat palsu oleh pihak  supir dan kernet tersebut.

Saya yakin petugas DISHUB sudah banyak mengetahui akan hal ini, dimohon ketegasaannya dalam menindak Supir & Kernet nakal dan arogan. jangan takut. Bila perlu koordinasikan kerjasama khusus dengan kepolisian untuk memberikan Sanksi tegas bila petugas DISHUB merasa takut saat menindak tegas mereka supir, kernet, dan pemilik kendaraan yang nakal.

Mohon ditindaklanjuti, terima kasih.",Direktorat Jenderal Perhubungan Darat
"Yth. Kepolisian RI,

Saya ingin melaporkan mengenai rawannya Masjid Istiqlal selama bulan puasa. Banyak copet yang beraksi karena tidak adanya petugas, khususnya di pintu Al-Fatah. Salahsatu pelaku berciri-ciri sebagai berikut: umur sekitar 50 tahun, cenderung gemuk, jalan tertatih-tatih, jika sampai bertatap mata dengan pelaku seolah kita lupa terhadap barang bawaan kita, biasanya pelaku tersebut bertiga. Para pelaku biasa beroperasi setelah sholat wajib, khususnya pada waktu maghrib.

Mohon ditindaklanjuti. Terimakasih.",Kepolisian Negara Republik Indonesia
"Yth. Kepolisian RI

Saya adalah pengguna rutin setiap hari minggu malam dini hari trayek bus Merak-Cikarang. Setiap perjalanan saya selalu ada copet yang beraksi di dalam bus, mereka beraksi ketika penumpang tidur. Mereka kadang naik dari Merak, Serang dan Bitung. Komplotan mereka biasa turun di daerah Bekasi, Jatiasih atau di Bekasi timur/barat. Mohon untuk pihak Kepolisian turun tangan mengatasi ini karena saya sudah 3 kali tas saya di silet. 

Terimakasih.

",Kepolisian Negara Republik Indonesia
"Yth. Kepolisian RI,

Menjelang hari raya mohon adakan pengamanan preman & copet di angkot dan metro mini, terutama untuk daerah Semper-Priok yang rawan tindak kriminalitas bahkan sudah menggunakan benda tajam. Terima kasih.",Kepolisian Negara Republik Indonesia
"YTH.KPD:PT.KAI COMMUJER JABOTABEK.DGN CARA MEMBERANGKATKAN PENUMPANG TRANSIT MEMBUKA LOWONGAN COPET.BERHENTI DI KP.PANDAN MENUJU KE KOTA SEBUAH HP.ADVAN 535E 3.5"" BERPINDAH TANGAN DGN SEGERA PADAHAL BARU DI BELI TGL.9.~6.~2015.WARNA HP.HITAM TRIM  ",PT Kereta Api Indonesia (Persero)
"tKps 3big5m5077507 Sy brtrmksh skl dpt bntuan KPS,krn bnyk membntu kehdpan km,tp krtu km mlh hlng krn kecopetan.Gmn crny km nnt agr bs mngmbl bntuan  dr tbpk?     ",Tim Sosialisasi KKS
"Yth. Kepolisian RI,

Saya ingin melaporkan mengenai banyaknya pencopet dijalan antara Stasiun Jatinegara-Jl. Pisangan. Mohon bapak polisi menangkap pencopet tersebut karena meresahkan masyarakat. Untuk masyarakat umum harap berhati-hati jika berjalan kaki dengan membawa tas pada saat setelah maghrib di jalan antara Stasiun Jatinegara-Jl.Pisangan banyak copet yang dengan berani membuka dan merogoh tas.

Ciri-ciri pencopet tersebut:
- Jaket parasut warna hitam
- Topi warna hitam
- Tinggi badan antara 165-170 cm
- Jam operasi setelah maghrib pkl 18.00 keatas

Mohon ditindaklanjuti. Terimakasih.",Kepolisian Negara Republik Indonesia
"Tolong berantas pencopet di angkot 05, bulan lalu saya sudah menjadi korban, saat itu mereka beroperasi sekitar jam 9 malam didalam angkot 05, nuhun",Satuan Polisi Pamong Praja Kota Bandung
"Pagi ini saya baru mengalami kecopetan di KOPAJA 602 jurusan Mampang - Monas via jalur busway. Dompet berisi uang beserta semua kartu penting hilang. Ketika lapor ke polisi, ternyata kasus copet di angkutan umum seperti Metro Mini dan Kopaja katanya memang umum terjadi.

Saya pilih naik Kopaja semata karena efisiensi waktu, walaupun kondisi angkutan tersebut sangat tidak layak karena penuh sesak. Ternyata kondisi ini menjadi sasaran empuk para copet. Kini saya paham kenapa banyak rekan kerja yang menghindari risiko ini dan masih memilih menggunakan kendaraan pribadi, walaupun harus membuang waktu dan biaya yang lebih besar. 

Andaikan dari Pemda bisa memberikan perhatian lebih di pagi dan sore untuk bisa mengerahkan berbagai sarana transportasi yang memungkinkan, baik itu milik instansi atau swasta, untuk memastikan para pegawai semua dapat terangkut dengan cepat dan selamat ke tempat kerja, itu suatu keniscayaan yang luar biasa.

Saya pesimis bila hanya berharap pada operator angkutan umum yang ada untuk bisa memperbaiki kinerja. Mereka mungkin malah senang dengan kondisi beban yang berlebih. Harus ada solusi tandingan.

Jakarta jadi kota tujuan wisata? Hmm sepertinya belum siap. Jangankan kenyamanan untuk pelancong, untuk warga Jakarta sendiri masih belum bisa aman naik kendaraan umum. Tolong jangan biarkan Jakarta menjadi 'scam city', tempat dimana para copet, pencoleng dan preman bisa merajalela. 

Mohon bantuannya. ",Pemerintah Provinsi DKI Jakarta
Dipasar Kaget Gasibu setiap hari minggu banyak berkeliaran penjamret dan copet yang terang terangan mohon ditindak lanjuti pa terima kasih,Satuan Polisi Pamong Praja Kota Bandung
"Yth. Kementerian Dalam Negeri,

Beberapa hari sebelumnya, KTP-el saya hilang karena dompet saya dicopet. Saya pun berniat untuk membuat kembali KTP-el tersebut. Pertama-tama, saya pergi ke kantor polisi untuk membuat surat kehilangan. 

Pada 30 Desember 2014, saya pun pergi ke kantor Kecamatan Plaju Ulu, Kota Palembang, Provinsi Sumatera Selatan yang beralamat di Jalan DI Panjaitan. Saat saya menanyakan bagaimana tahapan pembuatan KTP-el yang hilang, petugas kecamatan menyakan bahwa KTP-el tidak bisa dibuat lagi dengan alasan sekali seumur hidup.

Saya pun menanggapi, ""Apa tidak bisa jika melakukan duplikasi ulang dari data yang sudah ada sebelumnya?"" Ia menjawab ""Tidak bisa."" Cukup lama saya berdebat di kantor kecamatan tersebut, namun akhirnya saya tetap tidak bisa membuat ulang KTP-el saya.

Hal yang ingin saya tanyakan, apakah benar jika KTP-el hilang tidak bisa dibuat kembali? Bagaimana mungkin bisa seperti itu? Kalau yang bernasib seperti saya (kecopetan), data dirinya sebagai warga Indonseia apa jika tidak bisa melakukan pembuatan KTP-el ulang?

Saya mohon informasinya agar saya bisa membuat ulang KTP-el saya. Terima kasih.",Kementerian Dalam Negeri
"Yth. Kepolisian RI,

 Mohon perhatian Kepolisian untuk mengontrol daerah sekitar wilayah lampu merah sebelah RS Atmajaya dikarenakan rawan penjambretan di daerah tersebut. Minggu ini saja sudah terjadi tiga penjambretan ditempat yang sama. Hormat saya Sri Susilowati karyawan RS Pluit, mohon ditindaklanjuti. Terima kasih.",Kepolisian Negara Republik Indonesia
"Yth, Kepolisian Republik Indonesia,

Saya ingin melaporkan kejadi pencopetan HP Samsung Galaxy Mega yang terjadi di salah satu bus TransJakarta.

Kejadian copet tersebut terjadi pada hari Selasa tanggal 11 November 2014 pada pukul kurang lebih 11.00 WIB.. Saat itu saya menaiki bus lama jurusan Pulogadung berwarna biru, dari halte Harmoni dan berhenti di halte Senen.. 
 Saya baru sadar kejadi tersebut, setelah saya telah turun di halte Senen tetapi busnya telah jalan. Jadi saya sudah tidak bisa mengejar pencopet/pencurinya lagi. Namun, disini saya punya saksi seorang bapak pegawai kantor, yang pada saat itu menyadari dan mengambil foto kejadian sebelum saya dicopet. 

Tapi kenapa bapak saksi ini tidak bertindak kepada saya? Ya karena bapak ini juga pernah dicopet sama pencuri yang sama dan sebelumnya sudah dikode keras sama pencopet tersebut agar tidak bertindak sembarang. Hal ini jelas menunjukkan bahwa pencopet tersebut sudah melakukan tindakannya berkali-kali. Setelah berhari-hari, saya tetap keep contact sama bapaknya. Dan bapaknya memberi tahu kepada saya kalau sudah ada korban lagi seorang ibu-ibu yang kecurian hp Samsung S5, seorang bapak kantoran, dan seorang turis. Sudah berapa banyak korban dan sebara banyak lagi korban yang akan ada jika pencopet tersebut di biarkan? Sangat sedih memang rasanya ketika melihat pencopet yang saya tahu masih dengan bebas dapat mencuri hp-hp para korban lainnya.

Kejadian ini sudah lama beberapa minggu. Jadi dengan laporan ini, saya meminta kepada pihak kepolisian dan pihak TJ serta pihak lainnya yang terkait, agar dapat dengan tegas menindaklanjuti agar tidak ada lagi kasus pencopetan di TransJakarta. Karena bapak yang bersaksi pernah bilang kepada saya, kalo beberapa pencuri pernah ditangkap dan dibawa ke kantor polisi. Namun pencuri tersebut tetap dapat lolos karena ada bosnya jadi mohon agar diberantas juga sampai dalangnya. Mohon tindak lanjutnya. Terima kasih.",Kepolisian Negara Republik Indonesia
Tlon kpda pmerintah kmi mhon  pngwasan yg lbih baik lg kl pngambilan uang kompensasi BBM bgi pmegang hrus mnujukan KK dan KTP soalny bnyk warga mngambil uang pke kartu orang lain krna ptgas cma mlihat kartu KPS nya sja tdk di mnta mnujukan KTP  pdhal bnyak warga yg resah krna kartuny bnyak yg hlang kdang jga di ambil pra pncopet mhon prgtianya kpda pmrntah trmksh ini trjdi di daerah belik pemalang jateng,Kementerian Sosial
"Yth, Kepolisian RI,

Saya ingin memberikan masukan terkait masalah kriminalitas di atas transportasi publik yang sangat mengkhawatirkan di DKI Jakarta ini. Para pencopet selalu bekerja bergerombolan biasanya ber-4 diatas angkutan umum, dengan modus mereka yang sangat rapi namun mudah terdeksi. Mohon pihak kepolisian dapat memperketat pengamanan terkait hal ini karena moda transportasi publik merupakan sarana yang vital untuk masyarakat untuk beraktivitas. Sarana transportasi yang aman dan nyaman dapat mendorong masyarakat untuk menggunakan moda transportasi publik ini.

Mohon tindak lanjutnya. Terima kasih.",Kepolisian Negara Republik Indonesia
"Kepada Yth Pemprov DKI Jakarta, kami ingin melaporkan sejak diterbitkannya memo dari Pemprov DKI Jakarta mengenai tidak lagi diijinkannya adanya pedagang serta warung pada badan jalan. Kondisi keamanan tersebut menjadi rawan kejahatan dan semakin tidak aman, terutama di Jalan Cilamaya, dimana tidak ada portal dan pos kemanan yang justru berada jauh dari daerah yang rawan.  Hal ini sendiri sudah memberikan saya kerugian setidaknya dua kejadian yaitu spion mobil yang dipatahkan dan banyak kejadian lain seperti pemalakan, pencopetan, dan lain-lain. Terutama pada malam hari, tentunya hal tersebut sangat menganggu.  Mohon setidaknya agar ada penambahan lampu penerangan di kedua jalan tersebut dan daerah sekitarnya serta inovasi lain untuk membantu pengamanan di kawasan tersebut. Terima kasih.",Dinas Perindustrian dan Energi
"Yth. Kepolisian RI,
Saya ingin melaporkan tindak kriminal pencopetan di jembatan penyeberangan orang Halte GBK karena susah menghubungi polisi (call center 112 tidak bisa dihubungi). Ada komplotan pencopet yang sering beraksi di sana. Modusnya selalu sama, yaitu mengelilingi targetnya oleh beberapa orang dan tiba-tiba menjambret. Kemudian, lari menggunakan kopaja. Pada tanggal 6 September 2014, saya melihat lagi komplotan ini hampir beraksi. Sayang waktu saya mau rekam aksinya tiba-tiba mereka lari. Saya pernah hampir jadi korban dan sepertinya jika tidak tertangkap ini bisa beraksi terus. Mohon ditindaklanjuti. Terima kasih.",Kepolisian Daerah Metro Jakarta Raya
"Yth. Kementerian Perhubungan RI.

Yth. Kepolisian RI.

Di bus malam dari Jakarta ke Merak dan dari Merak ke Jakarta, setiap malam selalu ada copet dan selalu 3 orang. Bila sudah berhasil mereka langsung minta turun. Mohon untuk menjadi perhatian penumpang. Semua bus malam Jakarta ke Merak dan sebaliknya tolong dipasangi stiker “awas copet”. Ini nomor HP penanggung jawab 081212767541, para korban melapor tidak ditanggapi.

Terima kasih.",Direktorat Jenderal Perhubungan Darat
"Yth.Kepolisian Republik Indonesia,

Saya melaporkan telah terjadi pencopetan di arena PRJ Expo Kemayoran. Hari Sabtu, 5 Juli 2014 pukul 20.30. Pencuri berhasil mendapatkan dompet hitam berisi KTP a.n Haikal Hibatul Haq. No. laporan kepolisian 81/B/VII/2014/Sek.Kmo. 
Saya berharap kasus ini dapat diperhatikan oleh pihak kepolisian.
Mohon ditindak lanjuti. 

Terima kasih",Kepolisian Daerah Metro Jakarta Raya
"Yth. Kepolisian Republik Indonesia

Saya ingin melaporkan bahwa tindak pencopetan di dalam bus umum yang tidak kunjung hilang dan makin marak. Saya pernah mengalami hal ini hingga 2 kali. Saya merasa resah dan tidak nyaman menggunakan transportasi umum, seperti bus. 

Pada kejadian ke-2(terjadi di metromini P15 Senen-Setia  Budi) saya dengan rasa putus asa datang melapor ke kantor polisi supaya ini menjadi catatan & temuan bagi polisi. Namun, polisi yang bertugas hanya membuat surat kehilangan. Padahal yang saya tahu, setiap ada laporan polisi harus membuat semacam surat laporan. Berdasarkan informasi dari polisi yang bertugas tersebut dikatakan bahwa pihak kepolisian melakukan patroli, tetapi hanya di malam hari. Sedang dari keterangan orang lain dan yang saya alami sendiri justru tindak pencopetan terjadinya di pagi dan siang hari.

Harapan saya dan mewakili warga yang lain supaya ada siasat dari pihak kepolisian untuk  mengurangi tindak pencopetan tersebut dengan menurunkan personilnya baik di pagi dan siang hari juga. 
Jika polisi seharusnya dapat menyamar dan ikut masuk ke dalam bus-bus yang penuh sesak karena mereka biasa beraksi pada bus-bus yang penuh sesak seperti yang saya alami.


Semoga informasi ini bisa menjadi perhatian dari pihak kepolisian. Mohon ditindaklanjuti.

Terima kasih",Kepolisian Negara Republik Indonesia
"Assalamulaikum kang emil,Punteun mung bade ngadugikeun saran wungkul, supados ditindaklanjut kasus-kasus geng motor dibandung utamana ka barudak anu masih di SMP sareng SMA, ningal na hawatos masih aranom tapi kengeng ku hasutan-hasutan gaul anu teu jelas sapertos kitu, kumargi seueur ayeuna mah kasus jiga kitu, komo deui aya anggota geng anu anu orang tua na pejabat militer sapertos TNI sareng Polisi, supados calon-calon penerus engke na henteu kacandak ku anu teu puguh. Sareng transportasi di bandung oge seueur kasus anu prihatin kang emil sapertos copet sareng hipnotis, pami tiasa mah di no urut sapertos pesawat supados nyaman sareng keamanan oge kedah janten perhatian langkung kang. Diantos tindak lanjutna kang.Hatur nuhun kang, Bandung Juara !!!",Satuan Polisi Pamong Praja Kota Bandung
"Kepada Yth Pemprov DKI Jakarta
Ingin melaporkan Pelayanan Busway yang tidak nyaman.Saya sudah 2 kali kecopetan di busway karena kondisi halte dan bus yang sangat ramai, kedatangan bus yang lama, fasilitas penerangan yang mendukung aksi kejahatan, dan kurangnya petugas yang berada di bus ataupun di halte. Kalau terus seperti bagaimana bisa mewujudkan Transportasi massal yang diimpikan bersama.Mohon perhatiannya,terima kasih.",Badan Layanan Umum Transjakarta
"Minta tolong kepada yang berwenang untuk sering diadakan razia supir angkot tembak,yang tidak punya ijin mengemudi,karena sering kali jika naik angkot jurusan buah batu-kebon kelapa (Bandung),tukang/sopir angkot suka sekongkol dengan para copet yang berpura-pura jadi penumpang, bahkan banyak supir yang mengendarainya sambil mabuk, mohon pertolongannya, terima kasih atas perhatiannya.",Dinas Perhubungan Kota Bandung
"Kepada Yth, pemerintah kota Bandung--wabil khusus Pak Ridwan Kamil.

Baca berita ini dan tindaklah kejahatan ini (sekarang pencopet udah berani nglawan dan malah ngejar korban, sungguh aneh. Gak ada yang mau nolongin pula.):
http://bilt4blog.wordpress.com/2012/02/03/waspada-yaa-teman-teman/",Satuan Polisi Pamong Praja Kota Bandung
"Pasar Baru sarang copet, mohon ditindaklanjuti seperti di Tanah Abang Jakarta",Perumda Pasar Juara Kota Bandung
"Kepada Yth. Pemerintah Provinsi DKI Jakarta, saya ingin bertanya apakah bis umum dapat seperti bis di korea atau Jepang atau diganti dengan bis transjakarta tapi rute bis umum? menggunakan pintu otomatis dan banyak bangku, karena di bis umum sering terjadi kecopetan, membuat tidak nyaman maka itu banyak mobil di jalan.
Jakarta masih ada orang yang berbuat untuk merugikan orang lain. Mohon Penjelasan dari dinas terkait, terimakasih.",Dinas Perhubungan
"Saya ingin melaporkan, Tolong keamanan di seluruh Bus Transjakarta ditingkatkan karena mulai banyak pencopet yang masuk. Terima kasih.",Badan Layanan Umum Transjakarta
"Yth. Pengelola Jamkesmas,

Saya punya kartu Jamkesmas, tetapi hilang karena kecopetan. Kini saya hanya memiliki fotokopinya. Saya sudah lapor polisi dan diberi surat keterangan. Untuk berobat, ternyata tidak bisa memakai fotokopinya. Bagaimana cara mengganti kartu Jamkesmas yang hilang tersebut? Ke instansi mana saya harus mengurusnya?

Terima kasih.

(Suciati Sudiharsa, Kemayoran)",Kementerian Kesehatan
"Kopaja AC p20 Lebak Bulus - Senen tidak menghargai dan rawan tindak pencopetan.
Yth. Pemprov DKI Jakarta
Saya ingin mengadukan perihal Kopaja AC P20 Jurusan Lebak Bulus - Senen, bernomor polisi B7432NP, yang saya naiki pada hari Kamis, 17 Oktober 2013 sekitar pukul 17.10 WIB. Di Kopaja AC tersebut, kondisi penumpang sudah sangat penuh, bahkan untuk berdiri saja susah. Namun, kondektur tetap memaksakan penumpang dari luar masuk dan memaksa penumpang dari dalam kopaja untuk bergeser ke dalam. Praktis para penumpang marah-marah kepada kondektur Bukannya meminta maaf, supir malah ikut2an menyuruh kondektur mengembalikan uang ke salah satu penumpang agar segera menurunkan penumpang yang protes tersebut.

Disaat saya dan penumpang lain lengah,ternyata ada pencopet yang beraksi mencopet dompet saya dan mungkin dompet para penumpang lain. Saya baru menyadari dompet saya hilang saat turun di halte busway Patra Kuningan. Saya jadi curiga apakah ada kerjasama antara supir, kondektur dan pencopet tersebut. 

Padahal menurut info yang saya baca di infojkt.com,menurut Kepala Dishub DKI Jakarta, para supir kopaja AC digaji 2 juta rupiah sebulan. Kenapa masih seperti itu perilakunya? Mohon dengan sangat agar Dishub DKI Jakarta menindak hal ini, agar tidak erjadi lagi keresahan penumpang di Kopaja P20 AC. terima kasih",Dinas Perhubungan
"Kepada Yth. Pemprov DKI Jakarta. saya sudah tiga kali melihat pemandangan yang mengerikan di jembatan penyeberangan busway. Penyergapan seseorang dengan modus seolah-olah ada barang jatuh. Lalu si korban disergap oleh tiga sampai empat orang. Si korban tidak tahu kalau sedang dikelilingi oleh kelompok pencopet. Saya tidak berani berteriak memberi tahu, karena kelompok pencopet yang jumlahnya empat orang bukan tidak mungkin kalau saya berteriak akan berbalik menyerang saya. Karena saya pengguna jembatan penyeberang tiap hari, jadi dari pemantauan saya, setiap mereka berhasil melakukan operasinya, kira-kira 2 minggu mereka tidak ada di sekitar tempat kejadian (seperti rolling). Melalui media ini saya menghimbau agar jembatan penyeberangan di Jakarta ditingkatkan keamanannya. Mohon tindak lanjutnya. Terima kasih",Badan Layanan Umum Transjakarta
"Saya ingin melaporkan saya sebagai pengguna angkutan umum kopaja 19 trayek Ragunan ke tanah abang, di situ banyak pencopet ya, mohon tangkap ya, karena saya sebagai perempuan merasa sangat was-was dan selalu merasa curiga bahwa penumpang yang ada di samping saya, adalah copet. Mohon segera ditindak lanjuti. Terima kasih.",Dinas Perhubungan
"Yth Pemprov DKI jakarta, tolong turunkan ongkos k 56 jurusan cawang cileungsi dari 6000 menjadi 5000, angkot 121 jurusan kp rambutan cileungsi dari 7000 menjadi 5000 karna mereka telah menaikkan ongkos secara sepihak sejak lebaran 2012 dari 4000 menjadi 5000 tanpa persetujuan dishub dki dan perda pemprov dki, padahal saat itu bbm dan tarif tol tidak naik, kini bbm naik maka kenaikan ongkos 20%-30% sesuai peraturan pemerintah dan daerah, kalau di hitung ongkos 4000 * 20%-30% = 5000 bukan 6000 dan 7000, mohon diwujudkan demi kepentingan umum hajat hidup orang banyak bukan kepentingan properti walau disana ada perumahan mewah seperti kota wisata, citra grand, raflesia, kota legenda, cikeas, masih banyak masyarakat disana hidup miskin dan melarat, tolong di pertimbangkan dan ditindak lanjuti, kenapa sih cuma preman saja yg di berantas, kok copet tidak diberantas, padahal mereka meresahkan masyarakat sampai ancaman pembunuhan di angkutan umum, di terminal, di jalanan di berbagai wilayah dki jakarta, tolong di tindak lanjuti. Terima kasih",Dinas Perhubungan
"KPS 3776P914120A05 saya pulang dari rumah sakit cipto saya ke copetanan di metro mini di dlm dompet ktp,kartu jakarta sehat anak saya ,sama kartu perlindungan sosial saya hilang bagaimana cara buat lagi kartu perlindungan sosial dan tolong gimana saya harus melapor , kejadiannya kemaren sore pulang dari RSCM cipto (sri agustin riani).
RUSUN DKI  BLOK C LT 3 RW 003 RT 015, SEMPER BARAT, CILINCING, JAKARTA UTARA",Kementerian Sosial
KPS Ass. Mohon maaf pa sy kecopetan trus kps sy jga kena. Gimana cara ngurusnya kembali...?,Kementerian Sosial
"KPS ,Bpk,ibu yg trhormat,krt KPS hilang kecopetan, sy sdh lapor kekelurahan stmpt,kepolisian.namun sy mash gak bisa ngambil,gamana jalan solusinya,atas nama HERI SAFIK,Jln imam bonjol gang satria no 48 rt 01 segala mider tanjung karang barat b.lampung.",Kementerian Sosial
KPS kartu kps kami kecopetan.dan sampai saat ini belum ada yg mengembalikan. Ada tdk kebijakan dari kementrian sosial? Trims,Kementerian Sosial
KPS 376e161430A00 kartu saya hilang kecopetan Noldy Yani Elean,Kementerian Sosial
KPS Bagaimana solusinya kalo kartu kps kecopetan dan saya sudah lapor ke kepolisian untuk mengambil pencairan bagaimana ?,Kementerian Sosial
