report,unit
"Kepada Yth, Pemprov DKI Jakarta. Saya ingin melaporkan, bahwa banyak sekali copet berkeliaran di bus 43 jurusan Cililitan - Tanjung Priok, perilaku mereka sangat meresahkan penumpang, saya diancam akan dibunuh. Mohon ditindak lanjuti, Terima kasih",Dinas Sosial
"KPS 36620830000005.GIMANA SEANDAINYA KARTU KPS YG ASLI KECOPETAN,APA MSH BS MENGGUNAKAN FASILITASNYA.EN BGMN CARANYA.THANKS.",Kementerian Sosial
"KPS kartu kps saya hilang,saya terkena musibah dompet saya kecopetan,pada siapa kah saya harus bertanya,dan bagaimana.
Apakah saya masih bisa menerima kps lagi.",Kementerian Sosial
"Yth. Pemprov. DKI Jakarta, demi keamanan penumpang angkutan umum kami memohon pemerintah Tertibkan para Pencopet yg sering beraksi di Bus Mayasari Bahti 57 Blok M-Pulogadung,tindakan mereka sangat meresahkan penumpang tidak dapat berbuat apa apa karena mereka biasanya 3-5 orang atas perhatiannya kami ucapkan terimakasih. Ny.Nur Cahaya",Dinas Perhubungan
KPS 39jjke40291A09 Rumah tangga di daerah saya kartu KPS nya hilang di copet,Kementerian Sosial
Kps kartu kps saya hilang akibat kecopetan saat lebaran jd saya tidak dapat mengunakannya lagi. Saya hanya berharap kebijakan pemerintah saat ini atas nama sahdi,Kementerian Sosial
KPS Kartu KPS saya hilang kecopetan saya gak ingat nomer KPS saya.,Kementerian Sosial
"KPS 39o42m16431A04 yang terhormat KPS sy hilang kecopetan bagaimana cara mngurusinnya,dan  bagaimana sy mendapat hak sy kem bali? Saya sangat mngharap konfirmasi dr pihak BLSM, saya uncapkan trimakasih. # RO BIN  P SIAHAAN.",Kementerian Sosial
"Selamat siang saya ingin melaporkan mengenai kenyamanan Bus Transjakarta. Tolong dibasmi copet di Bus Transjakarta dan Halte Bus Transjakarta, karena sudah meresahkan para penumpang. Mohon secepatnya ditindak lanjuti. Terima kasih.",Badan Layanan Umum Transjakarta
"Kepada Yth Pemprov DKI Jakarta, saya warga Grogol Jakarta Barat. Tolong diberantas para pencopet di bus 91 jurusan Grogol - Batusari. Saya baru kecopetan kemarin sore jam 6. Saya lapor polisi terdekat tidak ada tanggapan. Kita warga DKI merasa tidak aman naik kendaraan umum sekarang. Mohon perhatiannya. Terimakasih.",Dinas Perhubungan
BBM ada pencopetan di pom bensin! Jaga negara supaya lebih baik,Tim Sosialisasi Kebijakan Penyesuaian Subsidi BBM
Yth. Pemrov DKI Jakarta. Mohon agar pelayanan Transjakarta dapat ditingkatkan. Perhatikan fasilitas untuk keamanan dan kenyamanan penumpang. Masih namyak didapati banyaknya copet dan petugas yang acuh. Terimakasih,Badan Layanan Umum Transjakarta
"Yth. Pemprov DKI. 
Saya mau lapor mengenai keamanan di bus dan halte bus Transjakarta. 
Saya sudah 2 kali kecopetan handphone di Koridor 1 (Blok M - Kota), bus Transjakarta.
Kejadian pertama : saya naik busway dari Bundaran HI ke arah Kota, di dalam busway ada dua orang yg mendesak-desak saya, padahal penumpang tidak penuh, dan ketika mereka berdua turun (di Halte Sarinah kalau tidak salah), handphone di kantong celana saya sudah hilang.
Kejadian kedua : saya mau naik busway dari Gajah Mada ke arah Blok M. Ketika menunggu bus datang (menunggu di halte), ada satu orang di belakang saya dengan tas di depan tubuhnya, mendesak-desak saya. Memang saat itu penumpang banyak dan antrian penuh. Ketika saya berhasil naik ke bus, handphone di kantong celana saya sudah hilang. (Orang tsb. tidak naik ke dalam bus).

Ketika saya lapor ke petugas di halte busway, petugasnya tidak tahu apa yg harus dilakukan. Jadi percuma lapor ke petugas busway.

Mohon keamanan di halte maupun dalam bus ditingkatkan, misalnya dengan menempatkan personel dari pihak kepolisian.
Mohon dibuatkan mekanisme pengaduan/laporan mengenai kejadian kriminal di halte maupun dalam bus Transjakarta, sehingga petugas bisa menangani kejadian seperti ini.
Terima kasih sebelumnya.",Badan Layanan Umum Transjakarta
"Sekarang makin banyak pencopet kambuhan di Busway. Beberapa juga tertangkap, masalahnya masyarakat seringkali tidak mau memperpanjang urusan dan memberikan keterangan di Polisi (buang-buang waktu menurut mereka). Hukuman yang diterima pencopet hanya dikeluarkan dari Busway. Apakah bisa dipertimbangkan hukuman agar pelaku difoto dan hasil fotonya ditempel di halte busway, untuk mencegah terjadinya kasus serupa berikutnya?",Badan Layanan Umum Transjakarta
"Yth. Pemprov DKI Jakarta. Saya kemarin pagi kecopetan di halte busway harmoni, saya sungguh kecewa dengan keamanan busway dan sikap para petugas yang sepertinya tidak mau peduli dengan keadaan saya. Mohon untuk ditingkatkan masalah keamanan dan kenyamanan bagi para pengguna busway. Terimakasih.",Badan Layanan Umum Transjakarta
"Yth. Pemprov DKI Jakarta, mohon lampu di jembatan busway Bendungan Hilir diperbaiki karena sejak tahun lalu mati. Kalau malam gelap, rawan copet karena ramai dan banyak pedagang. Terimakasih",Dinas Perindustrian dan Energi
"Selamat siang. Saya ingin mengajukan keluhan. Preman dan pengamen di Jakartasangat meresahkan terlebih di daerah Melawai. Mereka mencopet, memaksa bahkan melakukan pelecehan kepada penumpang. Hal ini membuat penumpang merasa tidak nyaman dan tidak aman untuk naik angkutan umum seperti metromini atau bis kota. Apakah Pemerintah Provinsi DKI Jakarta dapat membuat pengamen-pengamen ini diciduk secepatnya dan diberi penyuluhan?",Satuan Polisi Pamong Praja Provinsi DKI Jakarta
"Pelayanan bus Transjakarta yang buruk

Saya adalah seorang karyawan swasta yang bekerja di Tanjung Priok. Hampir setiap pagi selama 9 bulan ini saya menggunakan bus Transjakarta koridor 10 jurusan PGC-T.Priok, karena rumah saya berada tidak jauh dari halte BKN, satu halte setelah PGC.

Selain dengan bus Transjakarta, alternatif lain untuk menuju T, Priok adalah menggunakan PPD nomor 43, namun dengan kondisi yang cukup mengerikan (menurut saya). Mengerikan karena,1. bus tersebut menaikkan dan menurunkan penumpang dalam waktu sepersekian detik dan tidak dipinggir jalan 2. kapasitas yang terlalu dipaksakan oleh kernek. Bus juga  bisa miring ke satu sisi karena jumlah penumpang yang banyak, dan penumpang juga memaksa untuk masuk karena tidak bisa mengandalkan bus Transjakarta koridor 10, dan terkenal dengan PPD yang berisi copet2. 

Meskipun jumlah PPD tersebut lebih banyak daripada bus Transjakarta koridor 10, saya tetap menggunakan bus TJ koridor 10 tersebut dengan alasan safety. 

Keluhan saya adalah  antara jumlah bus TJ yang kurang atau penjadwalan (sistem management) yang tidak baik. Jumat, tanggal 1 Maret, saya menunggu busway kurang lebih 45 menit sehingga saya sangat sangat terlambat. Penumpang yang lain juga sudah terpancing emosinya dan menurut saya hal tersebut sangat wajar. 
Hal ini tidak terjadi sekali saja, hampir setiap minggu terjadi 2-3 kali.
Begitu juga ketika pulang. Sering kali tidak tersedia Bus TJ dari Tanjung Priok dan menyebabkan halte ticketingnya di tutup.

Yang hampir terjadi setiap hari adalah, bus TJ yang kapasitasnya penuh sekali mulai dari PGC-UKI, dan setelah itu penumpang tidak bisa masuk lagi dari halte setelah UKI. Penumpang yang naik dari halte stasiun Jatinegara (cukup banyak)sudah dilewatkan berkali-kali oleh bus TJ sehingga menumpuk dan begitu selanjutnya.

Saya juga bingung dengan polisi di sepanjang jalur koridor 10 yang tidak pernah membantu, bahkan terkesan membiarkan mobil yang lewat tepat di depannya untuk masuk jalur busway. Apakah pihak Polantas tidak bisa ikut membantu mengatasi mobil2 ini untuk memasuki jalur busway?

Saya miris dengan negara ini. Disaat masyarakat sudah berpartisipasi menggunakan transportasi umum untuk mengurangi kemacetan, saya merasa pemerintah tidak menanggapinya dengan maksimal. Saya juga miris ketika macet2an dan bersempit2an menggunakan bus TJ, dan saya menengeok keluar, depan, belakang, dan samping saya dipenuhi oleh kendaraan2 pribadi yang hanya berisi seorang setiap mobil. Apakah tidak punya hati lagi untuk bersabar sehingga masuk jalur busway??

Saya tidak hanya kecewa dengan pemerintah, namun juga warga2 bermobil yang masuk ke jalur busway yang tidak menghargai perjuangan warga yang lain untuk mengurangi kemacetan.

",Dinas Perhubungan
"Selamat sore Pak, tolong cari solusi soal keterlambatan bus Transjakarta jurusan Monas/Harmoni - Ragunan dan sebaliknya, karena kami menunggu sangat lama, ada pula bus yang kosong malah jalan saja, padahal penumpang sudah banyak yang ngantri. Jadi telat tiba di kantor dan kemalaman tiba di rumah. Adapula penumpang yang main dorong-dorongan, sampai ada yang kecopetan. Tolong petugasnya diperketat, dan kalau bisa ada petugas bagian pemberitahuan untuk kedatangan bus pada setiap jurusan. Terima kasih.",Dinas Perhubungan
"Kendaraan penumpang tipe kopaja mengeluarkan asap yang sangat menganggu pengguna jalan. Ditambah lagi dengan supir kendaraan yang selalu ugal-ugalan. Kopaja jurusan Lebak Bulus - Blok M juga rawan copet.
Kapan ada rencana Pemerintah Provinsi DKI Jakarta untuk meningkatkan pelayanan angkutan umum? Jika banyak copet dan rawan kejahatan, bagaimana warga mau beralih ke angkutan umum?
Terimakasih.",Dinas Perhubungan
"Pak saya mau minta tolong agar pihak pemerintah mengupayakan pembersihan tukang copet, diseputar/disekitar Jakarta (khususnya CITRA LAND,GROGOL,SLIPI DAN TEMPAT PERBELAJAAN). Saya sudah menjadi korban berkali-saya sudah extra hati-hati, tapi rupanya ""mereka"" punya TEAM WORK. Saya dengar mereka bekerja sama dengan beberapa orang salah satunya dengan supir dan kenek. Terakhir jam 18.30 DI LAMPU MERAH SLIPI PERTAMBURAN KEJADIAANNYA DI DALAM KOPAJA 88 JURUSAN TANAH ABANG-KALIDERES. Tapi semua  penumpang diberhentikan di LAMPU MERAH SLIPI PERTAMBURAN. Saya sangat bersyukur kalau laporan saya ini segera ditindak lanjuti secepatnya, karena saya yakin KORBANNYA BUKAN SAYA SAJA. Teman saya juga baru kecopetan di PASAR TANAH ABANG, baru-baru ini. Terima kasih.",Dinas Sosial
