report,unit
"Mohon dapat dicetak ulang kartu jamkesda yang hilang atas nik sesuai ktp terlampir, kartu hilang pada waktu kecopetan",DINAS KESEHATAN Kabupaten Grobogan
"Bisa di bantu untuk informasi no kartu peserta jamsostek saya yang hilang karena kecopetan
saya tidak bisa lakukan pencairan jht nya karena tidak tau no peserta nya
jamsostek dari pt kalbe farma tahun 2010
atas nama wiwin nurdiani
no ktp 3328094511880003",BPJS Ketenagakerjaan Kacab Jakarta Rawamangun
Lima tahun lalu saya kecopetan.kartu bpjs tk saya ikut raib bersama dompetnya.saya ingin aktifkan kartu bpjs tk saya lagi.tapi saya lupa nomernya.saya atas nama mohamad sofiudin,PEP
"Asalamualaikum. Pa maaf saya lancang. Mohon ijinsekedar ingin silaturahmi dan menyampaikan sedikit pendapat dan meminta gagasan mengenai ( cfd ) yg ada di kota garut saya pribadi pedagang yg selalu berjualan di cfd itu sendriri,  dengan rasa takut dan mungkin beresiko bagi sya akan mendapat buli atau cibiran dari bnyak ""pihak"" saya mencoba memberanikan diri untuk menyapa saber pungli langsung. Dengan harapan saya mendapat masukan apa yg harus sya lakukan mengenai hal ini. Maaf pa sekali lagi ini pun baru dugaan saya yg awam mengenai hal2 ini. Ncfd garut sudah ada kurang lebih 3 tahun. Pada awal mula cfd itu sendiri terlihat baik sesuai peruntukan nya. Makin kesini trutama 2 thun yg sya rasakan pedagang makin banyak makin tidak terkendali. Sya salah satu nya.dengan bnyak nya pedagang maka muncul lah masalah2 seperti sampah dan pencopetan, maka muncul lah kepengurusan cfd yg sya sendiri asing melihat pengurus2 tersebut. Kami di undang oleh mereka untuk mengadakan pertemuan dan di sepakati di dalam pertemuan tersebut rp.5.000,- / tenda atau pedagang. Untuk petugas yg membersihkan sampah. Yg mengatasnamakan pengurus cfd garut maka kami menyetujui nya.semakin kesini uang ""retribusi""  tersebut terus meningkat sipnifikan kurang dari setahun sekarang menjadi rp.15000/tenda atau pedagang, (bersipat wajib) dan kami di minta mengganti ukuran tenda oleh pengurus dari 3x3 menjadi 2x2 karna bnyak nya peminat ingin berjualan sya pun demikin. Dan kami pun di minta menyerahkan pas foto dan identitas ktp juga membayar 50.000 ribu per pedagang. Namun sampai saat ini kta yg mereka janjikan pun belum juga sya terima.sya mulai mencoba menghitung dengan perkiraan sya..kurang lebih hitungan kasar sya pedagang cfd garut ada 800 tenda, maka saya mulai menghitung pendapatan pengurus secara kasar.15000 x 800 = rp. 12.000.000,-dalam 1 bulan kurang lebih ada 4  hari minggu12.000.000 x 4 = rp. 48.000.000,- /bulandalam satu tahun perkiraan sya bisa mencapai rp. 576.000.000,-""angka yg luar biasa bagi saya pedagang kecil""disitulah sya tidak melihat adanya kontribusi pengurus sebagai penarik kontribusi. Entah kamana uang tersebut lari nya? Pengelolaan sampah harus kami para pedagang juga yg memungut nya ""tidak di adakan nya bak sampah sepanjang cfd"" padahal uang tersebut di atas cukup untuk membeli atau memperbaiki pasilitas cfd itu sendiri. Sya peribadi pun sma pedagang dan tidak merasa keberatan di apabila di minta uang restribusi ""sekalipun mungkin pedagang yg belum penglaris sma sekali"" dengan catatan trasparansi nya. Cfd sekarang sudah tidak di berlakukan lagi karna roda 2 dan 4 di perbolehkan lewat.  namun demikian, penarikan retribisi sebesar rp.15.000 masih di mintai. Sya berharap tim saber pungli ini dapat menyelidiki 1. Kemana uang retribusi ini mengalir2. Apakah ada orang dinas terkait yg bermain3. Apakah legalitas kepengurusandengan ini saya siap cfd di tiadakan  meskipun sya pribadi mengais rejeki berjualan di dalam nya namun karna saya hanya ikut meng kritisi apa yg terjadi untuk kemaslahatan pedagang dan kaum kecil. Mohon maaf bpa/ibu, dalam hal ini sya lancang atau ada kata2 dan penulisan yg tidak jelas dan di mengerti. Mohon kiranya dapat di tanggapi terimakasih. Wasalamualaikum",Kepolisian Negara Republik Indonesia
"Saya ingin melaporkan modus yamg dilakukan seorang pria di dalam mikrolet m32 nomer seri b ,,47, perumnas klender – kp. Melayu. Pada tanggal  january 31, 2020, seorang pria berpura2x sakit dan kejang2x di dalam mikrolet m32. Beliau berteriak2x minta ditolong dan minta saya tuk bergeser duduk saya dan tutup jendela. Saya melakukan apa yang diperintahkan nya karena saya melihat dia jatuh dari tempat duduk dan teriak2x kakinya keram. Sesudah saya menutup jendela beliau minta saya tuk pegang tangannya tetapi saya tidak melakukannya. Tapi akhirnya dia yang memegang lengan saya. Dan sesudah beliau memegang tangan saya beliau tiba2x minta turun dari mikrolet dan tidak membayar. Dia turun di apotik asta nugraha duren sawit. Sesudah dia turun , dia terlihat baik2x saja. Disebelah kiri saya ada seorang laki2x dan di sebelah kanan saya ada seoarng perempuan juga di dekat pintu yang menghadap berlawanan arah ada seorang pria berperawakan besar. Saat pria tersebut tidak ada di mirkolet lagi, para penumpang membicarakan kejadian tersebut dan curiga bahwa kalo tingkah tersebut adalah modus. Maka saya dengan segera membuka tas saya dan melihat kedalam tas saya bahwa dompet saya sudah tidak ada lagi. Lalu saya turun dan bicara kepada supir bahwa saya kehilangan dompet dan tidak dapat membayar. Sang sopir berkata tidak apa2x. Sepertinya si supir sangat mengerti apa yang menimpa saya. Lalu saya segera menelpon bank saya dan memblokir semua kartu saya. Kemudian saya berjalan ke arah dimana lelaki yang berpura2x turun. Disana saya menanyai orang2x yang ada disekitar dan menceritakan kejadian tersebut. Mereka menyuruh saya untuk menyelusuri di daerah pasar inpres duren sawit yang mana menurut mereka di situlah para penjahat berkumpul. Saya bertanya kepada salah satu penjual di depan pasar inpres dan dia berkata itu benar. Lalu beliau minta saya tuk pergi ke taman dimana mereka berkumpul. Saat tiba disana, tidak ada orang yang saya cari dan lelaki yang duduk di sebelah kiri saya. Lelaki yang di sebelah kiri turun di pasar inpres. Kemudian saya pergi ke tempat dimana para supir aplusan. Dan saya memberitahukan mereka bahwa saya kehilangan di dalam mikrolet dan memberitahu ciri2x supir pada saya naik mikrolet tersebut. Saya menunggu beberapa saat dan saya akhirnya bertemu dengan pak supir. Saya bertanya nomer plat mikrolet kepada beliau dan meminta nama supir yang melanjutkan setelah beliau. Dia memberitahukan nomer plat nya tetapi hanya 2 nomer belakang juga dengan nama supir yang melanjutkan sesudah beliau. Plat nya b..47 dan namanya buyung, umurnya setengah baya warna kulit hitam. Semua supir yang sedang beristirahat di depan toko harvest buaran mengatakan bahwa mereka mengetahui modus pria yang berpura2x sakit tersebut. Mereka bilang bahwa pria tersebut tidak sendiri. Dia melakukanya dengan 2 lelaki lainnya.  mereka mengatakan bahwa penjahat tersebut sering beroperasi di daerah duren sawit dan sekitarnya. Tetapi mereka tidak melaporkan ke polisi. Saya mengatakan kepada mereka juga bahwa saya memohon kalo mereka bertemu dengan penjahat tersebut tuk mengembalikan dompet saya karena saya butuh ktp, bpjs dan beberapa kartu keanggotaan lainnya. Saya juga memberikan nomer telepon saya agar si supir yang melihat kejadian di dalam mikrolet tsb tuk menelpon saya. Lalu saya pergi ke bank tuk mengambil uang dari teller karena saya tidak punya uang sama sekali di tas saya. Di bank saya mendapat laporan dari cs bahwa ada pencobaan penarikan atm dan kartu kredit tetapi tidak berhasil karena telah diblokir. Dr kartu kredit dilaporkan bahwa penjahat tersebut mencoba melakukan transaksi sebesar rp 3.814.432 di buaran selular dan dia/mereka mencoba melakukannya 2x pada jam 11.36 dan 11.37. Dengan kartu atm terlihat mereka gagal memasukan nomer pin sebanyak 3x. Tetapi saya lupa menyakan kepada cs dimana transaksi atau penarikan yang dilakukan dengan menggunakan kartu atm. Pada jam 18.40 saya mendapatkan sms bahwa dia/mereka mencoba tuk melakukan transaksi lagi sebesar rp 3.800.000 tetapi gagal. Sesudah dari bank saya pergi ke pospol untuk mendapatkan surat kehilangan agar saya dapat mengurus ktp. Kemudian saya ke kelurahan dan mendapatkan resi. Sesudah dari kelurahan saya pergi ke terminal perumnas klender tuk mendapatkan informasi dari para supir mikrolet apabila mereka mengetahui modus tersebut. Mereka mendengar berita tersebut dan meminta saya tuk melaporkan ke polisi. Mereka memohon untuk dilaporkan ke polisi segera karena sudah sering terjadi di mikrolet mereka entah itu m29 atau m32. Mereka menyatakan bahwa kejadian membuat kerugian karena banyak penumpang tidak mau naik mikrolet lagi karena modus kejahatan tersebut. Mereka juga mengatakan bahwa m32 situasinya sangat ngeri saat ini dan kejadian selalu terjadi pada jam2x sepi yaitu antara jam 10 - 12. Dimana pada jam tersebut itulah terjadi kepada saya yang mana tepatnya pada jam 11.15 atau 11.20. Demikianlah surat laporan ini saya buat dengan harapan agar polisi menindaki modus kejahatan ini agar tidak terulang lagi kejadian nya. Saya sangat berharap polisi berpatroli di wilayah tersebut untuk melihat kejadian ini dan menangkap para penjahat ini. Saya bersedia untuk diajak kerjasama tuk menangkap para bandit ini. Dengan adanya pencobaan transaksi dengan kartu atm dan kartu kredit mungkin akan mempermudah pelacakan untuk menangkap para bandit tersebut.",Kepolisian Negara Republik Indonesia
"Kepada yth.
Kementerian Perhubungan
c.q. Dinas Perhubungan

Salam hormat

Melalui tulisan ini saya ingin menyampaikan keluhan atas moda transportasi darat (bus) dari Jember ke banyuwangi atau sebaliknya.

1. Kondisi fisik
Kondisi fisik bus banyak yang tidak layak jalan, apalagi jika kita lihat akses dari dan menuju Banyuwangi yang sebagian besar adalah pengunungan, aspek keselamatan dan kemanan penumpang sering diabaikan.
2. Keamanan
Selama bertahun tahun untuk moda transportasi di wilayah ini peningkatan kemanan kepada penumpang sangat minim, banyak sekali kejadian (pencopetan, penipuan, dll) selalu terjadi, apalagi untuk trayek malam hari. Satu satunya peningkatan adalah adanya bus patas ke wilayah Banyuwangi, tetapi jadwal sangat minim.
3. Ketepatan waktu
Hal ini yang paling banyak dirasakan oleh pengguna, bisa kita bayangkan perjalanan dari Jember ke Banyuwangi bisa memakan waktu 4,5 sd 6 jam. Bukan karena kondisi jalan, karena 50% waktu tempuh tersebut digunakan untuk menunggu full penumpang,baru berangkat, ditopang dengan kondisi pada poin 1 di atas, lengkap sudah bahwa perjalanan dipastikan sangat amat lambat sekali.

Kami mohon pihak pihak terkait dapat menertibkan hal tersebut, karena seolah terjadi pembiaran selama bertahun - tahun.

Sekian terima kasih",Dinas Perhubungan
"Saya pengguna krl. di stasiun tanah tinggi tangerang, ketika keluar dari tap out stasiun, para pengguna krl akan menjuju pintu keluar yg ada di sebelah kanan dan kiri gerbang gate tap in dan tap out. di sepanjang jalanan tersebut, tidak disediakan penerangan jalan, jadi jika pengguna krl pulang dan datang ke stasiun tanah tinggi tangerang di malam hari, kami kegelapan karena tidak ada lampu yg menerangi di tempat tersebut. bisa dicek jika sudah malam yang bisa menyebabkan keselamatan saya terancam, karena suasana yang sangat gelap dan tidak adanya cctv atau perekam di daerah tersebut. di tangga tangga penyeberangan daerah sekitar juga tidak ada lampu penerangan, di tangga penyeberangan di depan mal balekota dan di dekat flyover dekat pln. saya pernah kecopetan bluetooth earphone di daerah tersebut, oleh orang yang mengendarai motor, earphone yg masih terpasangang ditelinga saya direbut oleh orang tersebut.",PT Kereta Api Indonesia (Persero)
"Saya pengguna krl. Di stasiun tanah tinggi tangerang, ketika keluar dari tap out stasiun, para pengguna krl akan menjuju pintu keluar yg ada di sebelah kanan dan kiri gerbang gate tap in dan tap out. Di sepanjang jalanan tersebut, tidak disediakan penerangan jalan, jadi jika pengguna krl pulang dan datang ke stasiun tanah tinggi tangerang di malam hari, kami kegelapan karena tidak ada lampu yg menerangi di tempat tersebut. Bisa dicek jika sudah malam yang bisa menyebabkan keselamatan saya terancam, karena suasana yang sangat gelap dan tidak adanya cctv atau perekam di daerah tersebut. Di tangga tangga penyeberangan daerah sekitar juga tidak ada lampu penerangan, di tangga penyeberangan di depan mal balekota dan di dekat flyover dekat pln. Saya pernah kecopetan bluetooth earphone di daerah tersebut, oleh orang yang mengendarai motor, earphone yg masih terpasangang ditelinga saya direbut oleh orang tersebut.",PT Kereta Api Indonesia (Persero)
Lapor hendi ..kmrn tgl 6 januari 2020 jam 13.09..sy naik brt jurusan mangkang sy kecopetan dompet..brt saat itu penuh. mohon solusinya.,Dinas Perhubungan Kota Semarang
"Pak polisi yang terhormat,

belakangan kian marak aksi kejahatan, baik dirumah ataupun dijalan raya. ditempat saya tinggal saat ini saja (palembang) dalam 1 minggu ini terjadi 3 aksi begal. untuk itu saya merasa perlu melindungi diri dengan alat tambahan, karena menyimpan benda beharga pun tidak cukup untuk tidak mengundang tindak kejahatan. 2 minggu yang lalu saja saya pernah melihat copet didepan mata saya yang langsung kabur seusai melakukan aksinya, begitu akan ditangkap dia melawan membawa senjata tajam sehingga membuat orang takut untuk menangkapnya dan copet pun lolos.

saya pernah membaca artikel bahwa pemakaian alat pelindung diri seperti taser (alat kejut) diperbolehkan, yang ingin saya tanyakan adalah:
1. benarkah penggunaan alat tersebut (seperti taser dan paprica spray) untuk pelindung diri diperbolehkan?
2. apakah membawa alat tersebut melanggar aturan atau bisa dikenakan pidana atau hal lainnya?

demikinalah pertanyaan dari saya,
saya menunggu jawaban jelas secepatnya.
atas perhatian dan kerjasamanya, saya ucapkan terima kasih.
hormat saya,",Kepolisian Negara Republik Indonesia
"Saya sartika nasabah bank bri, saya kecopetan pada tanggal 21 0ktober 2019. saya sudah mengajukan pembuatan buku tabungan dan atm pengganti di cabang teras kota tangerang. cuma sudah hampir 2 bulan belum ada kabar dari bank bri. saya sudah menanyakan ke bank bri tetapi jawabannya sama... belum ada kabar. 0adahal kata.nya nunggu 2 minggu saja buat penerbitannya. saya cuma butuh uang saya di dalam atm itu. saya cuma rakyat biasa.. dan sangat butuh dana tersebut.ketika saya konfirmasi lewat cs bri..  masih sama jawabannya harus menunggu. dan menunggu...tolong lah bank bri. bantu percepat.. ini udah terlalu lama.kan zaman sudah modern. menunggu info saja... harus bebulan2.",PT Bank Rakyat Indonesia (Persero) Tbk
"Mohon petunjuk tata cara pengajuan pemblokiran imei pada handphone yang hilang, perihal peraturan menteri (permen) kominfo nomor 11 tahun 2019 tentang pengendalian alat dan/atau perangkat telekomunikasi yang tersambung ke jaringan bergerak seluler melalui identifikasi international mobile equipment identity (imei).Atau jika perlu permohonan agar di ambil tindakan dan bantuannya untuk melakukan pemblokiran atas hanphone saya yang hilang dicuri/dicopet pada tgl 22 Desember 2019 sekitar Pk : 10.30 W.I.B di Stasiun Tanah Abang Jakarta Pusat dengan no. imei 1: 864484045988194, imei 2: 864484045988186 & serial number : C819SGQ06D00 merk vivo v15 warna merah glamor.Terima Kasih atas perhatian dan kebijaksanannya.",Direktorat Jenderal Sumber Daya dan Perangkat Pos dan Informatika
"Untuk keamanan di sekitar kampus usu agar segera di perbaiki, karena banyak mahasiswa yang kehilangan motor, dompet, dan barang berhaga lainnya. baik itu krn pencopetan scr lngsung maupun tersembunyi. 

lokasi : universitas sumatera utara, medan, sumatera utara",Kepolisian Negara Republik Indonesia
"Kepada yth
bapak kepala satuan polisi pamong praja kota p. siantar
di tempat

dengan hormat
pak mohon agar sering melalukan pemantauan di sekitar pajak parluasan, karena masyarakat ataupun pengunjunng masih sering kena copet. terimakasih",Satuan Polisi Pamong Praja
"Selamat pagi, saya mau melaporkan 2 hal. yang pertama keadaan jalan yang rusak di beberapa di daerah jalan karbela timur, setiabudi, kuningan, dekat rs mata aini. jalan sudah tidak pernah di aspal sejak 10 tahun lebih, keadaan jalan sudah rusak, malah saya lihat yang di aspal jalan gang2 kecil yang belum rusak. hal kedua, tolong dibuatkan bumper speed atau polisi tidur di jalan karbela timur, hal ini dikarenakan banyak kendaraan yang kebut sesuka hati, terutama motor. karena lingkungan banyak pejalan kaki dan anak2. dan sering kali terjadi penjambretan atau copet yang menggunakan motor karena jalan track lurus yang memudahkan penjambret melarikan diri, saya berharap dengan dibuatkan bumper speed dapat mengurangi kendaraan yang kebut dan tindak kejahatan. saya sebagai warga dki jakarta sangat peduli akan hal ini, semoga pemerintah dapat segera merealisasikannya. atas perhatian dan kerja samanya saya ucapkan banyak terima kasih.",Pemprov DKI 2
"Kendala dalam pembuatan paspor baru

yth. bapak/ibu
direktorat jenderal imigrasi

dengan ini saya mengadukan masalah dalam pembuatan paspor baru yang di persulit kantor imigrasi juanda, sidoarjo. saya pernah memiliki paspor pada tahun 2009, akan tetapi paspor saya hilang di tahun 2010 karena pada waktu itu paspor saya taruh di dalam dompet dan dompet saya di copet orang. pada tahun 2019 saya akan mengurus paspor baru,  setelah di periksa kelengkapan (ktp, kk, surat dispenduk, dll) sudah lengkap. pada waktu proses wawancara, di lihat ktp dan di tanya pada bagian wawancara ""apakah anda sebelumnya sudah memiliki paspor?"" saya jawab ""sudah, tapi pada tahun 2010 hilang"". setelah itu di koreksi masalah dokumen-dokumen pelengkap lainnya. katanya ada perbedaan dengan nama yang ada di ktp dengan nama yang ada di akta kelahiran. selanjutnya di perintahkan untuk mengurus ktp sementara dulu di dispenduk capil sidoarjo. selanjutnya bagian wawancara mengatakan ""untuk masalah paspor yang pernah anda miliki, apa benar-benar hilang? atau lupa meletakkan? saya jawab ""paspor saya benar-benar hilang"". bagian wawancara menjelaskan lagi ""apabila paspor anda benar-benar hilang, anda segera mengurus surat kehilangan di kepolisian setempat dan selanjutnya datang kembali ke kantor imigrasi untuk dilakukan bap dan membayar denda 1.000.000. dan apabila paspor anda rusak, anda tetap dilakukan bap akan tetapi denda yang anda bayar agak ringan yaitu 500.000"". setelah saya meminta surat kehilangan di kantor kepolisian yang dekat tkp, saya melakukan bap. pada waktu di bap, saya tetap di persulit untuk mengurus paspor baru dengan alasan tetap di suruh mencari paspor yang lama. dan apabila paspor lama tidak ketemu, saya kena penangguhan selama 6 bln, dalam artian saya tidak bisa membuat paspor selama 6 bulan. kasus ini sudah pernah saya alami pada tahun 2017, akan tetapi saya tidak mendapatkan surat penangguhan paspor. sedangkan saya butuh paspor untuk bulan desember 2019.

pengaduan selanjutnya yaitu dipersulit pengurusan paspor kepada anak yang belum mumayyiz atau belum cakap hukum dan kedua orang tuanya telah bercerai. anak tersebut hak asuhnya telah di pegang ibunya. menurut undang-undang nomor 1 tahun 1974 tentang perkawinan bab viii putusnya perkawinan serta akibatnya
pasal 41
akibat putusnya perkawinan karena perceraian ialah:
a. baik ibu atau bapak tetap berkewajiban memelihara dan mendidik anak-anaknya, sematamata berdasarkan kepentingan anak; bilamana ada perselisihan mengenai penguasaan anak-anak, pengadilan memberi keputusannya;
b. bapak yang bertanggung jawab atas semua biaya pemeliharaan dan pendidikan yang diperlukan anak itu; bilamana bapak dalam kenyataan tidak dapat memenuhi kewajiban tersebut, pengadilan dapat menentukan bahwa ibu ikut memikul biaya tersebut;
c. pengadilan dapat mewajibkan kepada bekas suami untuk memberikan biaya penghidupan dan/atau menentukan sesuatu kewajiban bagi bekas isteri.
dan menurut khi (kompilasi hukum islam) bab xiv: pemeliharaan anak 
pasal 105
dalam hal terjadinya perceraian:
a.  pemeliharaan anak yang belum mumayyiz atau 
      belum berumur 12 tahun adalah hak ibunya;
b.  pemeliharaan anak yang sudah mumayyiz 
      diserahkan kepada anak untuk memilih diantara.  
      ayah atau ibunya sebagai pemegang hak 
      pemeliharaanya;
c.   biaya pemeliharaan ditanggung oleh ayahnya.

pada waktu pengecekan dokumen-dokumen kelengkapan ditanyakan mengenai putusan petceraian dan akta cerai kedua orang tuanya, dan ternyata dokumen-dokumen tersebut telah dilengkapi oleh ibunya. pada saat wawancara, disuruh mendatangkan orang tua laki-laki dengan alasan meminta peraetujuan. padahal hak asuh anak yang belum mumayyiz atau belum berumur 12 tahun adalah hak ibunya, mengapa perlu diminta tanfatangan ayahnya? sedangkan ayahnya tidak menghiraukan dan atau tidak petnah mengurusi anak tersebut. 

mohon solusi secepatnya mengenai pelayanan dan penanganan kantor imigrasi kelas 1 khusu sidoarjo.",Jawa Timur - Kanim Kelas I Surabaya
"Siang, saya ingin melaporkan kasus copet yg marak terjadi, d daerah senen,.jakarta pusat
tepatnya d trotoar depan blok 1 dan blok2 senen,.
bersebrangan dg bioskop grand senen...
umumnya trotoar ini d gunakan bg yg mau k halte busway d bawah flyover senen.

d trotoar sdh ada coretan pilox ""awas copet"",. berjarak sekitar 5 meter, namun sdh mulai pudar krn cuaca. modus pencopet itu adalah mendekati dari belakang org yg pakai tas ransel, utk kemudian membuka dan mengambil brng si korban

mhon agar dapat d jaga d daerah tsb. agar tdk terjadi penghakiman massa",Pemprov DKI 2
"Apakah ada pengembangan bis trans jateng ataupun pengembangan keamanan bis seperti bis trans jateng ke seluruh daerah jawa tengah? karena banyak sekali kejadian pencopetan, kejahatan seksual, dan sejenisnya khususnya di bis pantura. 
#ayolapor",Dinas Perhubungan Provinsi Jawa Tengah
"Banyak pencopet di sekitaran halte pasar senen - atrium.

tolong di tindak.tegas.
pencopet mendekati calon korban yang akan naik ke bajaj, grab, gojek, taxi dll. dengan alasan bahwa itu pesanan mereka (si pencopet). pencopet berramai² mendekati korban dan berusaha mengambil barang² berharga si korban.

sekedar informasi. polsek senen sangat dekat dari lokasi kumpul para pencopet tersebut. tolong di basmi para pencopet ini. sangat meresahkan. jangan sampai kami masyarakat yang turun langsung sendiri. kami masih mengharga hukum.",Kepolisian Negara Republik Indonesia
